{"schemaVersion":1,"generatedAt":"2026-10-21T08:25:40.514Z","timezone":"Europe/Warsaw","activityBasis":"createdTime","synchronization":{"status":"complete","lastSynchronizationAt":"2026-10-21T08:25:40.514Z"},"project":{"totalStudents":8,"activeStudents":1,"totalRecordings":28,"totalBytes":683094155,"recordingsLast7Days":2,"recordingsLast30Days":27,"lastSynchronizationAt":"2026-10-21T08:25:40.514Z"},"students":[{"studentId":"stu_365f3cc304b26f7c","displayName":"Student 365f","recordingCount":9,"totalBytes":201516722,"lastActivityAt":"2026-10-18T20:02:08.400Z"},{"studentId":"stu_4060309f8e9d8403","displayName":"Student 4060","recordingCount":7,"totalBytes":267642880,"lastActivityAt":"2026-10-09T16:42:39.802Z"},{"studentId":"stu_85091595dd8f343c","displayName":"Student 8509","recordingCount":0,"totalBytes":0,"lastActivityAt":null},{"studentId":"stu_95962ec68b0abf8c","displayName":"Student 9596","recordingCount":0,"totalBytes":0,"lastActivityAt":null},{"studentId":"stu_995412c2837287b7","displayName":"Student 9954","recordingCount":4,"totalBytes":50664322,"lastActivityAt":"2026-10-05T13:33:29.602Z"},{"studentId":"stu_b6797dd7d42733c3","displayName":"Student b679","recordingCount":3,"totalBytes":4710487,"lastActivityAt":"2026-10-12T17:54:58.939Z"},{"studentId":"stu_d4ec722d4f3bbb15","displayName":"Student d4ec","recordingCount":0,"totalBytes":0,"lastActivityAt":null},{"studentId":"stu_e184a43d8ccba611","displayName":"Student e184","recordingCount":5,"totalBytes":158559744,"lastActivityAt":"2026-10-04T17:44:22.691Z"}],"dailyActivity":[{"date":"2026-09-16","count":1},{"date":"2026-09-28","count":1},{"date":"2026-10-01","count":2},{"date":"2026-10-02","count":1},{"date":"2026-10-04","count":5},{"date":"2026-10-05","count":4},{"date":"2026-10-06","count":2},{"date":"2026-10-09","count":5},{"date":"2026-10-11","count":2},{"date":"2026-10-12","count":1},{"date":"2026-10-13","count":2},{"date":"2026-10-18","count":2}]}
